,Date,Study,Study Link,Journal,Severe,Severe lower bound,Severe upper bound,Severe p-value,Severe Significant,Severe Adjusted,Severe Calculated,Fatality,Fatality lower bound,Fatality upper bound,Fatality p-value,Fatality Significant,Fatality Adjusted,Fatality Calculated,Multivariate adjustment,Study Type,Sample Size,Study Population,Added on,Critical only,Discharged vs. death?
0,2020-05-20,Type 1 and Type 2 diabetes and COVID-19 related mortality in England: a whole population study,https://www.england.nhs.uk/wp-content/uploads/2020/05/valabhji-COVID-19-and-Diabetes-Paper-1.pdf,NHS England,,,,,,,,AOR 1.36,1.29,1.44,<0.01,Significant,Adjusted,Extracted,,Retrospective observational study,"61,414,470","All individuals registered with a GP practice in England and alive on the 19th February; data extracted on May 11, 2020.",,N,N
1,2020-05-19,Factors Associated With Intubation and Prolonged Intubation in Hospitalized Patients With COVID-19,https://www.ncbi.nlm.nih.gov/pubmed/32423368/,Otolaryngol Head Neck Surg,AOR 0.71,0.27,1.71,0.46,Not Significant,Adjusted,Extracted,,,,,,,,,Retrospective observational study,486,"Ten hospitals in the Chicago metropolitan area from March 1, 2020 to April 8, 2020",,Y,N
2,2020-05-15,Risk factors for clinical progression in patients with COVID-19: a retrospective study of electronic health record data in the United Kingdom,http://medrxiv.org/cgi/content/short/2020.05.11.20093096v1?rss=1,MedRxiv,AOR=0.41,0.14,1.02,0.71,Not Significant,Adjusted,Extracted,AOR=2.24,1.11,4.51,<0.05,Significant,Adjusted,Extracted,,Retrospective observational study,3753,Emergency department of Chelsea & Westminster Hospital NHS Foundation Trust between 1st January 2020 and 23rd April 2020,,N,N
3,2020-05-07,OpenSAFELY: factors associated with COVID-19-related hospital death in the linked electronic health records of 17 million adult NHS patients.,http://medrxiv.org/cgi/content/short/2020.05.06.20092999v1?rss=1,MedRxiv,,,,,,,,AHR 1.62,1.43,1.82,,Significant,Adjusted,Extracted,,Retrospective observational study,"17,425,445","TPP general practice in England from February 1 to April 25, 2020.",,N,N
4,2020-04-27,Estimating Survival of Hospitalized COVID-19 Patients from Admission Information,http://doi.org/10.1101/2020.04.22.20075416,medrxiv,,,,,,,,OR 0.79,0.62,1.01,0.06,Not Significant,Not Adjusted,Calculated,,Retrospective observational study,5233,"Northwell Health acute care hospitals on or after March 1, 2020, and were discharged or died before April 12, 2020. Clinical outcomes (i.e., discharges, mortality, and length of stay) were monitored until April 12, 2020, the final date of follow-up",,N,Y
